Amazon Link, Title, Author
http://www.amazon.ca/exec/obidos/ASIN/8120321413/ref=nosim/deliciousmons-22, ,  
http://www.amazon.com/exec/obidos/ASIN/0262240297/ref=nosim/deliciousmons-20, ABCL: An Object-Oriented Concurrent System, Akinori Yonezawa  
http://www.amazon.com/exec/obidos/ASIN/0262010925/ref=nosim/deliciousmons-20, ACTORS: A Model of Concurrent Computation in Distributed Systems, Gul Agha  
http://www.amazon.com/exec/obidos/ASIN/0136070477/ref=nosim/deliciousmons-20, AI Algorithms  Data Structures  and Idioms in Prolog  Lisp  and Java, George F. Luger  William A Stubblefield  
http://www.amazon.com/exec/obidos/ASIN/1584504218/ref=nosim/deliciousmons-20, AI Application Programming, M. Tim Jones  
http://www.amazon.com/exec/obidos/ASIN/0133708756/ref=nosim/deliciousmons-20, ANSI Common LISP, Paul Graham  
http://www.amazon.co.uk/exec/obidos/ASIN/8120323823/ref=nosim/deliciousmons-21, ARTIFICIAL INTELLIGENCE: A MODERN APPROACH, Russel  Norvig  
http://www.amazon.com/exec/obidos/ASIN/0471202835/ref=nosim/deliciousmons-20, Agile Database Techniques: Effective Strategies for the Agile Software Developer, Scott Ambler  
http://www.amazon.com/exec/obidos/ASIN/073561993X/ref=nosim/deliciousmons-20, Agile Project Management with Scrum, Ken Schwaber  
http://www.amazon.com/exec/obidos/ASIN/0201699699/ref=nosim/deliciousmons-20, Agile Software Development, Alistair Cockburn  
http://www.amazon.com/exec/obidos/ASIN/0130676349/ref=nosim/deliciousmons-20, Agile Software Development with Scrum, Ken Schwaber  Mike Beedle  
http://www.amazon.com/exec/obidos/ASIN/0135974445/ref=nosim/deliciousmons-20, Agile Software Development  Principles  Patterns  and Practices, Robert C. Martin  
http://www.amazon.com/exec/obidos/ASIN/0262530864/ref=nosim/deliciousmons-20, Algorithmic Skeletons: Structural Management of Parallel Computation, Murray I. Cole  
http://www.amazon.com/exec/obidos/ASIN/1933988665/ref=nosim/deliciousmons-20, Algorithms of the Intelligent Web, Haralambos Marmanis  Dmitry Babenko  
http://www.amazon.com/exec/obidos/ASIN/007001115X/ref=nosim/deliciousmons-20, Anatomy of Lisp, John Allen  
http://www.amazon.com/exec/obidos/ASIN/0070355967/ref=nosim/deliciousmons-20, The Architecture of Symbolic Computers, Peter M. Kogge  
http://www.amazon.com/exec/obidos/ASIN/071671938X/ref=nosim/deliciousmons-20, Armchair Universe, A.K. Dewdney  
http://www.amazon.com/exec/obidos/ASIN/B003ZHB2RK/ref=nosim/deliciousmons-20, The Art and Science of Smalltalk, Simon Lewis  
http://www.amazon.com/exec/obidos/ASIN/0471503363/ref=nosim/deliciousmons-20, The Art of Computer Systems Performance Analysis: Techniques for Experimental Design  Measurement  Simulation  and Modeling, R. K. Jain  
http://www.amazon.com/exec/obidos/ASIN/0201517973/ref=nosim/deliciousmons-20, The Art of Human-Computer Interface Design, Brenda Laurel  
http://www.amazon.com/exec/obidos/ASIN/0123705916/ref=nosim/deliciousmons-20, The Art of Multiprocessor Programming, Maurice Herlihy  Nir Shavit  
http://www.amazon.com/exec/obidos/ASIN/0596007868/ref=nosim/deliciousmons-20, The Art of Project Management, Scott Berkun  
http://www.amazon.com/exec/obidos/ASIN/0262610744/ref=nosim/deliciousmons-20, The Art of the Metaobject Protocol, Gregor Kiczales  Jim des Rivieres  Daniel G. Bobrow  
http://www.amazon.com/exec/obidos/ASIN/0262531151/ref=nosim/deliciousmons-20, Artificial Experts: Social Knowledge and Intelligent Machines, H. M. Collins  
http://www.amazon.com/exec/obidos/ASIN/B0017KNMCK/ref=nosim/deliciousmons-20, Artificial Intelligence, Elaine Rich  
http://www.amazon.com/exec/obidos/ASIN/0070522634/ref=nosim/deliciousmons-20, Artificial Intelligence, Elaine Rich  Kevin Knight  
http://www.amazon.com/exec/obidos/ASIN/8122416616/ref=nosim/deliciousmons-20, Artificial Intelligence, Christopher Thornton  
http://www.amazon.com/exec/obidos/ASIN/0201533774/ref=nosim/deliciousmons-20, Artificial Intelligence, Winston  
http://www.amazon.com/exec/obidos/ASIN/0538726970/ref=nosim/deliciousmons-20, The Artificial Intelligence Handbook: Business Applications, Joel G. Siegel  Jae K. Shim  
http://www.amazon.com/exec/obidos/ASIN/0763732303/ref=nosim/deliciousmons-20, Artificial Intelligence Illuminated, Ben Coppin  
http://www.amazon.com/exec/obidos/ASIN/0898596092/ref=nosim/deliciousmons-20, Artificial Intelligence Programming, Eugene Charniak  Christopher K. Riesbeck  Drew V. McDermott  James R. Meehan  
http://www.amazon.com/exec/obidos/ASIN/0262521237/ref=nosim/deliciousmons-20, Artificial Intelligence and Natural Man  Second Edition, Margaret A. Boden  
http://www.amazon.com/exec/obidos/ASIN/0321204662/ref=nosim/deliciousmons-20, Artificial Intelligence: A Guide to Intelligent Systems, Michael Negnevitsky  
http://www.amazon.com/exec/obidos/ASIN/047190581X/ref=nosim/deliciousmons-20, Artificial Intelligence: Concepts  Techniques  and Applications, Yoshiaki Shirai  J. Tsujii  
http://www.amazon.com/exec/obidos/ASIN/0321263189/ref=nosim/deliciousmons-20, Artificial Intelligence: Structures and Strategies for Complex Problem Solving, George F. Luger  
http://www.amazon.com/exec/obidos/ASIN/006041894X/ref=nosim/deliciousmons-20, Artificial Intelligence: Tools  Techniques and Applications, Tim O'Shea  M. Eistenstadt  
http://www.amazon.com/exec/obidos/ASIN/0201525712/ref=nosim/deliciousmons-20, Artificial Life II, Christopher G. Langton  Charles Taylor  J. Doyne Farmer  Steen Rasmussen  
http://www.amazon.com/exec/obidos/ASIN/020162494X/ref=nosim/deliciousmons-20, Artificial Life III, Christopher G. Langton  
http://www.amazon.com/exec/obidos/ASIN/0262621126/ref=nosim/deliciousmons-20, Artificial Life: An Overview, Christopher G. Langton  
http://www.amazon.com/exec/obidos/ASIN/0130534714/ref=nosim/deliciousmons-20, Automatic Natural Language Parsing, Karen Sparck Jones  Yorick Wilks  
http://www.amazon.com/exec/obidos/ASIN/0596510047/ref=nosim/deliciousmons-20, Beautiful Code: Leading Programmers Explain How They Think, Andy Oram  Greg Wilson  
http://www.amazon.com/exec/obidos/ASIN/1590595009/ref=nosim/deliciousmons-20, The Best Software Writing I: Selected and Introduced by Joel Spolsky, Joel Spolsky  
http://www.amazon.com/exec/obidos/ASIN/0201719606/ref=nosim/deliciousmons-20, Beyond Chaos: The Expert Edge in Managing Software Development, Larry L. Constantine  
http://www.amazon.com/exec/obidos/ASIN/0201775948/ref=nosim/deliciousmons-20, Beyond Software Architecture: Creating and Sustaining Winning Solutions, Luke Hohmann  
http://www.amazon.com/exec/obidos/ASIN/1558607838/ref=nosim/deliciousmons-20, Blondie24: Playing at the Edge of AI, David B. Fogel  
http://www.amazon.com/exec/obidos/ASIN/047020172X/ref=nosim/deliciousmons-20, Build Your Own Expert System, Chris Naylor  
http://www.amazon.com/exec/obidos/ASIN/0201719622/ref=nosim/deliciousmons-20, Building Parsers With Java, Steven John Metsker  
http://www.amazon.com/exec/obidos/ASIN/0262061570/ref=nosim/deliciousmons-20, Building Problem Solvers, Kenneth D. Forbus  Johan de Kleer  
http://www.amazon.com/exec/obidos/ASIN/0596102356/ref=nosim/deliciousmons-20, Building Scalable Web Sites: Building  Scaling  and Optimizing the Next Generation of Web Applications, Cal Henderson  
http://www.amazon.com/exec/obidos/ASIN/0130659037/ref=nosim/deliciousmons-20, Capacity Planning for Web Services: Metrics  Models  and Methods, Daniel A. Menasce  Virgilio A.F. Almeida  
http://www.amazon.com/exec/obidos/ASIN/0521773628/ref=nosim/deliciousmons-20, Causality: Models  Reasoning  and Inference, Judea Pearl  
http://www.amazon.com/exec/obidos/ASIN/3540629718/ref=nosim/deliciousmons-20, Clause and Effect: Prolog Programming for the Working Programmer, William F. Clocksin  
http://www.amazon.com/exec/obidos/ASIN/0735619670/ref=nosim/deliciousmons-20, Code Complete: A Practical Handbook of Software Construction, Steve McConnell  
http://www.amazon.com/exec/obidos/ASIN/1933988312/ref=nosim/deliciousmons-20, Collective Intelligence in Action, Satnam Alag  
http://www.amazon.com/exec/obidos/ASIN/0486402584/ref=nosim/deliciousmons-20, Combinatorial Optimization: Algorithms and Complexity, Christos H. Papadimitriou  Kenneth Steiglitz  
http://www.amazon.com/exec/obidos/ASIN/0393955443/ref=nosim/deliciousmons-20, Common LISPcraft, Robert Wilensky  
http://www.amazon.com/exec/obidos/ASIN/0486458806/ref=nosim/deliciousmons-20, Communication Nets: Stochastic Message Flow and Delay, Leonard Kleinrock  
http://www.amazon.com/exec/obidos/ASIN/0321486811/ref=nosim/deliciousmons-20, Compilers: Principles  Techniques  and Tools, Alfred V. Aho  Monica S. Lam  Ravi Sethi  Jeffrey D. Ullman  
http://www.amazon.com/exec/obidos/ASIN/047149111X/ref=nosim/deliciousmons-20, Computer Applications  Volume 2  Queueing Systems, Leonard Kleinrock  
http://www.amazon.com/exec/obidos/ASIN/4871878058/ref=nosim/deliciousmons-20, Computer Gamesmanship, David N. L. Levy  
http://www.amazon.com/exec/obidos/ASIN/0471798142/ref=nosim/deliciousmons-20, Computer Science Reconsidered: The Invocation Model of Process Expression, Karl M. Fant  
http://www.amazon.com/exec/obidos/ASIN/0195062825/ref=nosim/deliciousmons-20, Computers and Human Language, George W. Smith  
http://www.amazon.com/exec/obidos/ASIN/0262220695/ref=nosim/deliciousmons-20, Concepts  Techniques  and Models of Computer Programming, Peter Van Roy  Seif Haridi  
http://www.amazon.com/exec/obidos/ASIN/0534952119/ref=nosim/deliciousmons-20, Concrete Abstractions: An Introduction to Computer Science Using Scheme, Max Hailperin  Barbara Kaiser  Karl Knight  
http://www.amazon.com/exec/obidos/ASIN/0471987107/ref=nosim/deliciousmons-20, Concurrency: State Models & Java Programs, Jeff Magee  Jeff Kramer  
http://www.amazon.com/exec/obidos/ASIN/0262580977/ref=nosim/deliciousmons-20, The Connection Machine, W. Danny Hillis  
http://www.amazon.com/exec/obidos/ASIN/0471597538/ref=nosim/deliciousmons-20, Constructing Language Processors for Little Languages, Randy M. Kaplan  
http://www.amazon.com/exec/obidos/ASIN/0787967076/ref=nosim/deliciousmons-20, The Contrarian's Guide to Leadership, Steven B. Sample  
http://www.amazon.com/exec/obidos/ASIN/0884271536/ref=nosim/deliciousmons-20, Critical Chain, Eliyahu M. Goldratt  
http://www.amazon.com/exec/obidos/ASIN/0932633293/ref=nosim/deliciousmons-20, Data Model Patterns: Conventions of Thought, David C. Hay  
http://www.amazon.com/exec/obidos/ASIN/0130146595/ref=nosim/deliciousmons-20, Death March: The Complete Software Developer's Guide to Surviving 'Mission Impossible' Projects, Edward Yourdon  
http://www.amazon.com/exec/obidos/ASIN/0024216917/ref=nosim/deliciousmons-20, Decision Support and Expert Systems Ma, Efraim Turban  
http://www.amazon.com/exec/obidos/ASIN/0884271633/ref=nosim/deliciousmons-20, Deming and Goldratt, Domenico Lepore  Oded Cohen  
http://www.amazon.com/exec/obidos/ASIN/0262201755/ref=nosim/deliciousmons-20, Design Concepts in Programming Languages, Franklyn A. Turbak  David K. Gifford  
http://www.amazon.com/exec/obidos/ASIN/013215871X/ref=nosim/deliciousmons-20, A Discipline of Programming, Edsger W. Dijkstra  
http://www.amazon.com/exec/obidos/ASIN/8178672405/ref=nosim/deliciousmons-20, Distributed Algorithms,  
http://www.amazon.com/exec/obidos/ASIN/3540326510/ref=nosim/deliciousmons-20, Distributed Event-Based Systems, Gero Mühl  Ludger Fiege  Peter Pietzuch  
http://www.amazon.com/exec/obidos/ASIN/0321263545/ref=nosim/deliciousmons-20, Distributed Systems: Concepts and Design, Jean Dollimore  Tim Kindberg  George Coulouris  
http://www.amazon.com/exec/obidos/ASIN/0132392275/ref=nosim/deliciousmons-20, Distributed Systems: Principles and Paradigms, Andrew S. Tanenbaum  Maarten Van Steen  
http://www.amazon.com/exec/obidos/ASIN/0321125215/ref=nosim/deliciousmons-20, Domain-Driven Design: Tackling Complexity in the Heart of Software, Eric Evans  
http://www.amazon.com/exec/obidos/ASIN/0321712943/ref=nosim/deliciousmons-20, Domain-Specific Languages, Martin Fowler  
http://www.amazon.com/exec/obidos/ASIN/1400082463/ref=nosim/deliciousmons-20, Dreaming in Code: Two Dozen Programmers  Three Years  4 732 Bugs  and One Quest for Transcendent Software, Scott Rosenberg  
http://www.amazon.com/exec/obidos/ASIN/B00005TNXB/ref=nosim/deliciousmons-20, Dynamics of Software Development, Jim McCarthy  Denis Gilbert  
http://www.amazon.com/exec/obidos/ASIN/0716782693/ref=nosim/deliciousmons-20, The Elements of Artificial Intelligence Using Common Lisp, Steven L. Tanimoto  
http://www.amazon.com/exec/obidos/ASIN/032163537X/ref=nosim/deliciousmons-20, Elements of Programming, Alexander Stepanov  Paul McJones  
http://www.amazon.com/exec/obidos/ASIN/0262032252/ref=nosim/deliciousmons-20, Empirical Methods for Artificial Intelligence, Paul R. Cohen  
http://www.amazon.com/exec/obidos/ASIN/0321200683/ref=nosim/deliciousmons-20, Enterprise Integration Patterns: Designing  Building  and Deploying Messaging Solutions, Gregor Hohpe  Bobby Woolf  
http://www.amazon.com/exec/obidos/ASIN/0135717795/ref=nosim/deliciousmons-20, The Essence of Artificial Intelligence, Alison Cawsey  
http://www.amazon.com/exec/obidos/ASIN/0201111489/ref=nosim/deliciousmons-20, Essential Lisp, John R. Anderson  Albert Corbett  Brian J. Reiser  
http://www.amazon.com/exec/obidos/ASIN/0596522304/ref=nosim/deliciousmons-20, Even Faster Web Sites: Performance Best Practices for Web Developers, Steve Souders  
http://www.amazon.com/exec/obidos/ASIN/1590596439/ref=nosim/deliciousmons-20, Event-Based Programming: Taking Events to the Limit, Ted Faison  
http://www.amazon.com/exec/obidos/ASIN/0672217856/ref=nosim/deliciousmons-20, Experiments in artificial intelligence for small computers, John Krutch  
http://www.amazon.com/exec/obidos/ASIN/0534384471/ref=nosim/deliciousmons-20, Expert Systems: Principles and Programming  Fourth Edition, Joseph C. Giarratano  Gary D. Riley  
http://www.amazon.com/exec/obidos/ASIN/0201616416/ref=nosim/deliciousmons-20, Extreme Programming Explained: Embrace Change, Kent Beck  
http://www.amazon.com/exec/obidos/ASIN/048627263X/ref=nosim/deliciousmons-20, Flatland: A Romance of Many Dimensions, Edwin A. Abbott  
http://www.amazon.com/exec/obidos/ASIN/1871516498/ref=nosim/deliciousmons-20, Formalizing Common Sense: Papers By John Mccarthy, Vladimir Lifschitz  John McCarthy  
http://www.amazon.com/exec/obidos/ASIN/0521576814/ref=nosim/deliciousmons-20, The Functional Approach to Programming, Guy Cousineau  Michel Mauny  
http://www.amazon.com/exec/obidos/ASIN/0133315797/ref=nosim/deliciousmons-20, Functional Programming Application and Implementation, Peter Henderson  
http://www.amazon.com/exec/obidos/ASIN/0262610574/ref=nosim/deliciousmons-20, Functional Programming for Loosely-Coupled Multiprocessors, Paul H. J. Kelly  
http://www.amazon.com/exec/obidos/ASIN/0201137445/ref=nosim/deliciousmons-20, Functional Programming: Practice and Theory, Bruce J. Maclennan  
http://www.amazon.co.uk/exec/obidos/ASIN/8120322398/ref=nosim/deliciousmons-21, Fundamentals Of Parallel Processing, JORDAN HARRY  ALAGHBAND GITA  
http://www.amazon.com/exec/obidos/ASIN/0669194735/ref=nosim/deliciousmons-20, Fundamentals of Artificial Intelligence - Lisp, James Noyes  
http://www.amazon.com/exec/obidos/ASIN/0914894838/ref=nosim/deliciousmons-20, Fuzzy Sets  Natural Language Computations  and Risk Analysis, Kurt J. Schmucker  
http://www.amazon.com/exec/obidos/ASIN/0486296725/ref=nosim/deliciousmons-20, Game Theory: A Nontechnical Introduction, Morton D. Davis  
http://www.amazon.com/exec/obidos/ASIN/0201309777/ref=nosim/deliciousmons-20, Generative Programming: Methods  Tools  and Applications, Krysztof Czarnecki  Ulrich Eisenecker  
http://www.amazon.com/exec/obidos/ASIN/0201157675/ref=nosim/deliciousmons-20, Genetic Algorithms in Search  Optimization  and Machine Learning, David E. Goldberg  
http://www.amazon.com/exec/obidos/ASIN/013924218X/ref=nosim/deliciousmons-20, Global Software Teams: Colloborating Across Borders and Time Zones, Erran Carmel  
http://www.amazon.com/exec/obidos/ASIN/0805813667/ref=nosim/deliciousmons-20, Goal-based Decision Making: An Interpersonal Model, Stephen Slade  
http://www.amazon.com/exec/obidos/ASIN/0465026567/ref=nosim/deliciousmons-20, Gödel  Escher  Bach: An Eternal Golden Braid, Douglas R. Hofstadter  
http://www.amazon.com/exec/obidos/ASIN/0262522233/ref=nosim/deliciousmons-20, Great Ideas in Computer Science - 2nd Edition: A Gentle Introduction, Alan W. Biermann  
http://www.amazon.com/exec/obidos/ASIN/1565925092/ref=nosim/deliciousmons-20, HTTP: The Definitive Guide, David Gourley  Brian Totty  
http://www.amazon.com/exec/obidos/ASIN/0201914654/ref=nosim/deliciousmons-20, Hacker's Delight, Henry S. Warren  
http://www.amazon.com/exec/obidos/ASIN/0596006624/ref=nosim/deliciousmons-20, Hackers and Painters: Big Ideas from the Computer Age, Paul Graham  
http://www.amazon.com/exec/obidos/ASIN/0521644089/ref=nosim/deliciousmons-20, The Haskell School of Expression: Learning Functional Programming through Multimedia, Paul Hudak  
http://www.amazon.com/exec/obidos/ASIN/0201342758/ref=nosim/deliciousmons-20, Haskell: The Craft of Functional Programming, Simon Thompson  
http://www.amazon.com/exec/obidos/ASIN/0201442302/ref=nosim/deliciousmons-20, Hidden Order: How Adaptation Builds Complexity, John Holland  
http://www.amazon.com/exec/obidos/ASIN/0596529309/ref=nosim/deliciousmons-20, High Performance Web Sites: Essential Knowledge for Front-End Engineers, Steve Souders  
http://www.amazon.com/exec/obidos/ASIN/0130161640/ref=nosim/deliciousmons-20, High-Performance Java Platform Computing: Multithreaded and Networked Programming, Thomas W. Christopher  George K.  Ph.D. Thiruvathukal  
http://www.amazon.com/exec/obidos/ASIN/0262062186/ref=nosim/deliciousmons-20, How to Design Programs: An Introduction to Programming and Computing, Matthias Felleisen  Robert Bruce Findler  Matthew Flatt  Shriram Krishnamurthi  
http://www.amazon.com/exec/obidos/ASIN/0134340019/ref=nosim/deliciousmons-20, How to Solve It by Computer, R. G. Dromey  
http://www.amazon.com/exec/obidos/ASIN/3540660615/ref=nosim/deliciousmons-20, How to Solve It: Modern Heuristics, Zbigniew Michalewicz  David B. Fogel  
http://www.amazon.com/exec/obidos/ASIN/0805072551/ref=nosim/deliciousmons-20, How to Think About Statistics  6th Edition, John L. Phillips  
http://www.amazon.com/exec/obidos/ASIN/0321437381/ref=nosim/deliciousmons-20, Implementing Lean Software Development: From Concept to Cash, Mary Poppendieck  Tom Poppendieck  
http://www.amazon.com/exec/obidos/ASIN/0262192942/ref=nosim/deliciousmons-20, Innovative Applications of Artificial Intelligence, Herbert Schorr  Alain Rappaport  
http://www.amazon.com/exec/obidos/ASIN/0262680688/ref=nosim/deliciousmons-20, Innovative Applications of Artificial Intelligence 2, Alain Rappaport  Reid Smith  
http://www.amazon.com/exec/obidos/ASIN/0262691485/ref=nosim/deliciousmons-20, Innovative Applications of Artificial Intelligence 3, Reid Smith  A. Carlisle Scott  
http://www.amazon.com/exec/obidos/ASIN/0262691558/ref=nosim/deliciousmons-20, Innovative Applications of Artificial Intelligence 4, A. Carlisle Scott  Philip Klahr  
http://www.amazon.com/exec/obidos/ASIN/1558604200/ref=nosim/deliciousmons-20, Intelligent Java Applications for the Internet and Intranets, Mark Watson  
http://www.amazon.co.uk/exec/obidos/ASIN/8120324587/ref=nosim/deliciousmons-21, Introduction To Ai Robotics, MURPHY ROBIN R.  
http://www.amazon.com/exec/obidos/ASIN/0072970545/ref=nosim/deliciousmons-20, Introduction to Algorithms, Thomas Cormen  Charles Leiserson  Ronald Rivest  Clifford Stein  
http://www.amazon.com/exec/obidos/ASIN/0127748601/ref=nosim/deliciousmons-20, Introduction to Common Lisp, Taichi Yuasa et  
http://www.amazon.com/exec/obidos/ASIN/0471137723/ref=nosim/deliciousmons-20, Introduction to Computer Theory, Daniel I. A. Cohen  
http://www.amazon.com/exec/obidos/ASIN/0521794838/ref=nosim/deliciousmons-20, Introduction to Distributed Algorithms, Tel Gerard  
http://www.amazon.com/exec/obidos/ASIN/0521277248/ref=nosim/deliciousmons-20, Introduction to Functional Programming Systems Using Haskell, Antony J. T. Davie  
http://www.amazon.com/exec/obidos/ASIN/0521865719/ref=nosim/deliciousmons-20, Introduction to Information Retrieval, Manning Christopher D.  Raghavan Prabhakar  Schütze Hinrich  
http://www.amazon.com/exec/obidos/ASIN/0134861922/ref=nosim/deliciousmons-20, An Introduction to Lisp and Symbol Manipulation, Sharam Hekmatpour  
http://www.amazon.com/exec/obidos/ASIN/0136141390/ref=nosim/deliciousmons-20, Introduction to Logic, Irving M. Copi  Carl Cohen  
http://www.amazon.com/exec/obidos/ASIN/0262012111/ref=nosim/deliciousmons-20, Introduction to Machine Learning, Ethem Alpaydin  
http://www.amazon.com/exec/obidos/ASIN/0470519460/ref=nosim/deliciousmons-20, An Introduction to MultiAgent Systems, Michael Wooldridge  
http://www.amazon.com/exec/obidos/ASIN/1882114566/ref=nosim/deliciousmons-20, An Introduction to Programming in Emacs Lisp, Robert J. Chassell  
http://www.amazon.com/exec/obidos/ASIN/3540288457/ref=nosim/deliciousmons-20, Introduction to Reliable Distributed Programming, Rachid Guerraoui  Luís Rodrigues  
http://www.amazon.com/exec/obidos/ASIN/3000236457/ref=nosim/deliciousmons-20, An Introduction to Seaside,  
http://www.amazon.com/exec/obidos/ASIN/0534950973/ref=nosim/deliciousmons-20, Introduction to the Theory of Computation, Michael Sipser  
http://www.amazon.com/exec/obidos/ASIN/0884271153/ref=nosim/deliciousmons-20, It's Not Luck, Eliyahu M. Goldratt  
http://www.amazon.com/exec/obidos/ASIN/0321349601/ref=nosim/deliciousmons-20, Java Concurrency in Practice, Brian Goetz  Tim Peierls  Joshua Bloch  Joseph Bowbeer  David Holmes  Doug Lea  
http://www.amazon.com/exec/obidos/ASIN/1590593898/ref=nosim/deliciousmons-20, Joel on Software: And on Diverse and Occasionally Related Matters That Will Prove of Interest to Software Developers  Designers  and Managers  and to Those Who  Whether by Good Fortune or Ill Luck  Work with Them in Some Capacity, Joel Spolsky  
http://www.amazon.com/exec/obidos/ASIN/0262660709/ref=nosim/deliciousmons-20, Knowledge Discovery in Databases, Gregory Piatetsky-Shapiro  William J. Frawley  
http://www.amazon.com/exec/obidos/ASIN/1558609326/ref=nosim/deliciousmons-20, Knowledge Representation and Reasoning, Ronald Brachman  Hector Levesque  
http://www.amazon.com/exec/obidos/ASIN/0262570807/ref=nosim/deliciousmons-20, Languages and Compilers for Parallel Computing, David Gelernter  Alexandru Nicolau  David Padua  
http://www.amazon.com/exec/obidos/ASIN/1419644068/ref=nosim/deliciousmons-20, Lean Project Management: Eight Principles For Success, Lawrence P. Leach  
http://www.amazon.com/exec/obidos/ASIN/1563273055/ref=nosim/deliciousmons-20, Lean Software Strategies: Proven Techniques for Managers and Developers, Peter Middleton  James Sutton  
http://www.amazon.com/exec/obidos/ASIN/0743231643/ref=nosim/deliciousmons-20, Lean Thinking: Banish Waste and Create Wealth in Your Corporation, James P. Womack  Daniel T. Jones  
http://www.amazon.com/exec/obidos/ASIN/1435712757/ref=nosim/deliciousmons-20, Let Over Lambda, Doug Hoyte  
http://www.amazon.com/exec/obidos/ASIN/0135327628/ref=nosim/deliciousmons-20, Let's Talk LISP, Laurent Siklossy  
http://www.amazon.com/exec/obidos/ASIN/0201083191/ref=nosim/deliciousmons-20, Lisp, Patrick Winston  Berthold Horn  
http://www.amazon.com/exec/obidos/ASIN/0521545668/ref=nosim/deliciousmons-20, Lisp in Small Pieces, Christian Queinnec  
http://www.amazon.com/exec/obidos/ASIN/0673397734/ref=nosim/deliciousmons-20, Lisp  Objects and Symbolic Programming, Robert R. Kessler  
http://www.amazon.com/exec/obidos/ASIN/0442209746/ref=nosim/deliciousmons-20, Lisp: The Language of Artificial Intelligence, A. A. Berk  
http://www.amazon.com/exec/obidos/ASIN/026256114X/ref=nosim/deliciousmons-20, The Little MLer, Matthias Felleisen  Daniel P. Friedman  
http://www.amazon.com/exec/obidos/ASIN/0262560992/ref=nosim/deliciousmons-20, The Little Schemer - 4th Edition, Daniel P. Friedman  Matthias Felleisen  
http://www.amazon.com/exec/obidos/ASIN/0387517286/ref=nosim/deliciousmons-20, Logic Programming and Databases, Stefano Ceri  G. Gottlob  L. Tanca  
http://www.amazon.com/exec/obidos/ASIN/0201120801/ref=nosim/deliciousmons-20, Looking at Lisp, Tony Hasemer  
http://www.amazon.com/exec/obidos/ASIN/032119442X/ref=nosim/deliciousmons-20, MDA Explained: The Model Driven Architecture(TM): Practice and Promise, Anneke Kleppe  Jos Warmer  Wim Bast  
http://www.amazon.com/exec/obidos/ASIN/052156543X/ref=nosim/deliciousmons-20, ML for the Working Programmer, Lawrence C. Paulson  
http://www.amazon.com/exec/obidos/ASIN/1556150105/ref=nosim/deliciousmons-20, Machinery of the Mind: Inside the New Science of Artificial Intelligence, George Johnson  
http://www.amazon.com/exec/obidos/ASIN/0716721449/ref=nosim/deliciousmons-20, The Magic Machine: A Handbook of Computer Sorcery, A. K. Dewdney  
http://www.amazon.com/exec/obidos/ASIN/0195172116/ref=nosim/deliciousmons-20, Managing Business Complexity: Discovering Strategic Solutions with Agent-Based Modeling and Simulation, Michael J. North  Charles M. Macal  
http://www.amazon.com/exec/obidos/ASIN/159059844X/ref=nosim/deliciousmons-20, Managing Humans: Biting and Humorous Tales of a Software Engineering Manager, Michael Lopp  
http://www.amazon.com/exec/obidos/ASIN/0071374299/ref=nosim/deliciousmons-20, The McKinsey Mind: Understanding and Implementing the Problem-Solving Tools and Management Techniques of the World's Top Strategic Consulting Firm, Ethan Rasiel  Ph.D. Paul N. Friga  
http://www.amazon.com/exec/obidos/ASIN/0070534489/ref=nosim/deliciousmons-20, The McKinsey Way, Ethan Rasiel  
